{
  "schema_version": "1.0.0",
  "document_hash": "b9c70c74911fad7992a01f77d861a33f10f8313c96a9f58c09b2f448a54c8344",
  "pdf_page": 101,
  "orientation": "A-row-B-column",
  "row_labels": [
    "A0",
    "A1",
    "A2",
    "A3",
    "A4",
    "A5",
    "A6",
    "A7",
    "A8",
    "A9",
    "A10",
    "A11",
    "A12",
    "A13",
    "A14",
    "A15",
    "A16",
    "A17"
  ],
  "column_labels": [
    "B0",
    "B1",
    "B2",
    "B3",
    "B4",
    "B5",
    "B6",
    "B7",
    "B8",
    "B9",
    "B10",
    "B11",
    "B12",
    "B13",
    "B14",
    "B15",
    "B16",
    "B17"
  ],
  "cells": {
    "1,1": {
      "a": 1,
      "b": 1,
      "outcome": "-",
      "normalized_outcome": "no_convention",
      "evidence_ids": [
        "sha256:b9c70c74911fad7992a01f77d861a33f10f8313c96a9f58c09b2f448a54c8344:page:101"
      ],
      "reviewer_id": "Antonio Oliva Carceles <antonio.oliva.carceles@gmail.com>"
    },
    "1,2": {
      "a": 1,
      "b": 2,
      "outcome": "A",
      "normalized_outcome": "A_full",
      "evidence_ids": [
        "sha256:b9c70c74911fad7992a01f77d861a33f10f8313c96a9f58c09b2f448a54c8344:page:101"
      ],
      "reviewer_id": "Antonio Oliva Carceles <antonio.oliva.carceles@gmail.com>"
    },
    "1,3": {
      "a": 1,
      "b": 3,
      "outcome": "B",
      "normalized_outcome": "B_full",
      "evidence_ids": [
        "sha256:b9c70c74911fad7992a01f77d861a33f10f8313c96a9f58c09b2f448a54c8344:page:101"
      ],
      "reviewer_id": "Antonio Oliva Carceles <antonio.oliva.carceles@gmail.com>"
    },
    "1,4": {
      "a": 1,
      "b": 4,
      "outcome": "B",
      "normalized_outcome": "B_full",
      "evidence_ids": [
        "sha256:b9c70c74911fad7992a01f77d861a33f10f8313c96a9f58c09b2f448a54c8344:page:101"
      ],
      "reviewer_id": "Antonio Oliva Carceles <antonio.oliva.carceles@gmail.com>"
    },
    "1,5": {
      "a": 1,
      "b": 5,
      "outcome": "B",
      "normalized_outcome": "B_full",
      "evidence_ids": [
        "sha256:b9c70c74911fad7992a01f77d861a33f10f8313c96a9f58c09b2f448a54c8344:page:101"
      ],
      "reviewer_id": "Antonio Oliva Carceles <antonio.oliva.carceles@gmail.com>"
    },
    "1,6": {
      "a": 1,
      "b": 6,
      "outcome": "B",
      "normalized_outcome": "B_full",
      "evidence_ids": [
        "sha256:b9c70c74911fad7992a01f77d861a33f10f8313c96a9f58c09b2f448a54c8344:page:101"
      ],
      "reviewer_id": "Antonio Oliva Carceles <antonio.oliva.carceles@gmail.com>"
    },
    "1,7": {
      "a": 1,
      "b": 7,
      "outcome": "B",
      "normalized_outcome": "B_full",
      "evidence_ids": [
        "sha256:b9c70c74911fad7992a01f77d861a33f10f8313c96a9f58c09b2f448a54c8344:page:101"
      ],
      "reviewer_id": "Antonio Oliva Carceles <antonio.oliva.carceles@gmail.com>"
    },
    "1,8": {
      "a": 1,
      "b": 8,
      "outcome": "A",
      "normalized_outcome": "A_full",
      "evidence_ids": [
        "sha256:b9c70c74911fad7992a01f77d861a33f10f8313c96a9f58c09b2f448a54c8344:page:101"
      ],
      "reviewer_id": "Antonio Oliva Carceles <antonio.oliva.carceles@gmail.com>"
    },
    "1,9": {
      "a": 1,
      "b": 9,
      "outcome": "B",
      "normalized_outcome": "B_full",
      "evidence_ids": [
        "sha256:b9c70c74911fad7992a01f77d861a33f10f8313c96a9f58c09b2f448a54c8344:page:101"
      ],
      "reviewer_id": "Antonio Oliva Carceles <antonio.oliva.carceles@gmail.com>"
    },
    "1,10": {
      "a": 1,
      "b": 10,
      "outcome": "-",
      "normalized_outcome": "no_convention",
      "evidence_ids": [
        "sha256:b9c70c74911fad7992a01f77d861a33f10f8313c96a9f58c09b2f448a54c8344:page:101"
      ],
      "reviewer_id": "Antonio Oliva Carceles <antonio.oliva.carceles@gmail.com>"
    },
    "1,11": {
      "a": 1,
      "b": 11,
      "outcome": "B",
      "normalized_outcome": "B_full",
      "evidence_ids": [
        "sha256:b9c70c74911fad7992a01f77d861a33f10f8313c96a9f58c09b2f448a54c8344:page:101"
      ],
      "reviewer_id": "Antonio Oliva Carceles <antonio.oliva.carceles@gmail.com>"
    },
    "1,12": {
      "a": 1,
      "b": 12,
      "outcome": "B",
      "normalized_outcome": "B_full",
      "evidence_ids": [
        "sha256:b9c70c74911fad7992a01f77d861a33f10f8313c96a9f58c09b2f448a54c8344:page:101"
      ],
      "reviewer_id": "Antonio Oliva Carceles <antonio.oliva.carceles@gmail.com>"
    },
    "1,13": {
      "a": 1,
      "b": 13,
      "outcome": "B",
      "normalized_outcome": "B_full",
      "evidence_ids": [
        "sha256:b9c70c74911fad7992a01f77d861a33f10f8313c96a9f58c09b2f448a54c8344:page:101"
      ],
      "reviewer_id": "Antonio Oliva Carceles <antonio.oliva.carceles@gmail.com>"
    },
    "1,14": {
      "a": 1,
      "b": 14,
      "outcome": "B",
      "normalized_outcome": "B_full",
      "evidence_ids": [
        "sha256:b9c70c74911fad7992a01f77d861a33f10f8313c96a9f58c09b2f448a54c8344:page:101"
      ],
      "reviewer_id": "Antonio Oliva Carceles <antonio.oliva.carceles@gmail.com>"
    },
    "1,15": {
      "a": 1,
      "b": 15,
      "outcome": "B",
      "normalized_outcome": "B_full",
      "evidence_ids": [
        "sha256:b9c70c74911fad7992a01f77d861a33f10f8313c96a9f58c09b2f448a54c8344:page:101"
      ],
      "reviewer_id": "Antonio Oliva Carceles <antonio.oliva.carceles@gmail.com>"
    },
    "1,16": {
      "a": 1,
      "b": 16,
      "outcome": "B",
      "normalized_outcome": "B_full",
      "evidence_ids": [
        "sha256:b9c70c74911fad7992a01f77d861a33f10f8313c96a9f58c09b2f448a54c8344:page:101"
      ],
      "reviewer_id": "Antonio Oliva Carceles <antonio.oliva.carceles@gmail.com>"
    },
    "1,17": {
      "a": 1,
      "b": 17,
      "outcome": "A*",
      "normalized_outcome": "exception",
      "evidence_ids": [
        "sha256:b9c70c74911fad7992a01f77d861a33f10f8313c96a9f58c09b2f448a54c8344:page:101"
      ],
      "reviewer_id": "Antonio Oliva Carceles <antonio.oliva.carceles@gmail.com>"
    },
    "1,18": {
      "a": 1,
      "b": 18,
      "outcome": "B",
      "normalized_outcome": "B_full",
      "evidence_ids": [
        "sha256:b9c70c74911fad7992a01f77d861a33f10f8313c96a9f58c09b2f448a54c8344:page:101"
      ],
      "reviewer_id": "Antonio Oliva Carceles <antonio.oliva.carceles@gmail.com>"
    },
    "2,1": {
      "a": 2,
      "b": 1,
      "outcome": "B",
      "normalized_outcome": "B_full",
      "evidence_ids": [
        "sha256:b9c70c74911fad7992a01f77d861a33f10f8313c96a9f58c09b2f448a54c8344:page:101"
      ],
      "reviewer_id": "Antonio Oliva Carceles <antonio.oliva.carceles@gmail.com>"
    },
    "2,2": {
      "a": 2,
      "b": 2,
      "outcome": "-",
      "normalized_outcome": "no_convention",
      "evidence_ids": [
        "sha256:b9c70c74911fad7992a01f77d861a33f10f8313c96a9f58c09b2f448a54c8344:page:101"
      ],
      "reviewer_id": "Antonio Oliva Carceles <antonio.oliva.carceles@gmail.com>"
    },
    "2,3": {
      "a": 2,
      "b": 3,
      "outcome": "B",
      "normalized_outcome": "B_full",
      "evidence_ids": [
        "sha256:b9c70c74911fad7992a01f77d861a33f10f8313c96a9f58c09b2f448a54c8344:page:101"
      ],
      "reviewer_id": "Antonio Oliva Carceles <antonio.oliva.carceles@gmail.com>"
    },
    "2,4": {
      "a": 2,
      "b": 4,
      "outcome": "B",
      "normalized_outcome": "B_full",
      "evidence_ids": [
        "sha256:b9c70c74911fad7992a01f77d861a33f10f8313c96a9f58c09b2f448a54c8344:page:101"
      ],
      "reviewer_id": "Antonio Oliva Carceles <antonio.oliva.carceles@gmail.com>"
    },
    "2,5": {
      "a": 2,
      "b": 5,
      "outcome": "B",
      "normalized_outcome": "B_full",
      "evidence_ids": [
        "sha256:b9c70c74911fad7992a01f77d861a33f10f8313c96a9f58c09b2f448a54c8344:page:101"
      ],
      "reviewer_id": "Antonio Oliva Carceles <antonio.oliva.carceles@gmail.com>"
    },
    "2,6": {
      "a": 2,
      "b": 6,
      "outcome": "B",
      "normalized_outcome": "B_full",
      "evidence_ids": [
        "sha256:b9c70c74911fad7992a01f77d861a33f10f8313c96a9f58c09b2f448a54c8344:page:101"
      ],
      "reviewer_id": "Antonio Oliva Carceles <antonio.oliva.carceles@gmail.com>"
    },
    "2,7": {
      "a": 2,
      "b": 7,
      "outcome": "B",
      "normalized_outcome": "B_full",
      "evidence_ids": [
        "sha256:b9c70c74911fad7992a01f77d861a33f10f8313c96a9f58c09b2f448a54c8344:page:101"
      ],
      "reviewer_id": "Antonio Oliva Carceles <antonio.oliva.carceles@gmail.com>"
    },
    "2,8": {
      "a": 2,
      "b": 8,
      "outcome": "B",
      "normalized_outcome": "B_full",
      "evidence_ids": [
        "sha256:b9c70c74911fad7992a01f77d861a33f10f8313c96a9f58c09b2f448a54c8344:page:101"
      ],
      "reviewer_id": "Antonio Oliva Carceles <antonio.oliva.carceles@gmail.com>"
    },
    "2,9": {
      "a": 2,
      "b": 9,
      "outcome": "B",
      "normalized_outcome": "B_full",
      "evidence_ids": [
        "sha256:b9c70c74911fad7992a01f77d861a33f10f8313c96a9f58c09b2f448a54c8344:page:101"
      ],
      "reviewer_id": "Antonio Oliva Carceles <antonio.oliva.carceles@gmail.com>"
    },
    "2,10": {
      "a": 2,
      "b": 10,
      "outcome": "B",
      "normalized_outcome": "B_full",
      "evidence_ids": [
        "sha256:b9c70c74911fad7992a01f77d861a33f10f8313c96a9f58c09b2f448a54c8344:page:101"
      ],
      "reviewer_id": "Antonio Oliva Carceles <antonio.oliva.carceles@gmail.com>"
    },
    "2,11": {
      "a": 2,
      "b": 11,
      "outcome": "B",
      "normalized_outcome": "B_full",
      "evidence_ids": [
        "sha256:b9c70c74911fad7992a01f77d861a33f10f8313c96a9f58c09b2f448a54c8344:page:101"
      ],
      "reviewer_id": "Antonio Oliva Carceles <antonio.oliva.carceles@gmail.com>"
    },
    "2,12": {
      "a": 2,
      "b": 12,
      "outcome": "B",
      "normalized_outcome": "B_full",
      "evidence_ids": [
        "sha256:b9c70c74911fad7992a01f77d861a33f10f8313c96a9f58c09b2f448a54c8344:page:101"
      ],